<?xml version="1.0" encoding="UTF-8"?>
<?xml-stylesheet type="text/xsl" href="svg_creator.xsl"?>
<!DOCTYPE game SYSTEM "game_states.dtd">
<games>
  <game id="0" game_state="active">
    <flippedCard>0</flippedCard>
    <active_player_id>1</active_player_id>
    <players>
      <player id="1">
		<name>Hans</name>
        <points>0</points>
		</player>
      <player id="2">
        <name>Jens</name>
        <points>2</points>
      </player>
    </players>
    <cards scale_factor="4.5">
      <card id="1" pair="1" card_state="shown">
        <position_x>10</position_x>
        <position_y>10</position_y>
      </card>
      <card id="2" pair="1" card_state="shown">
        <position_x>31</position_x>
        <position_y>10</position_y>
      </card>
      <card id="3" pair="2" card_state="shown">
        <position_x>10</position_x>
        <position_y>31</position_y>
      </card>
      <card id="4" pair="2" card_state="hidden">
        <position_x>31</position_x>
        <position_y>31</position_y>
      </card>
    </cards>
  </game>
</games>